{
  "schemaVersion": "1.0",
  "batchId": "batch-4",
  "subjectId": "iot102",
  "sourceKind": "question-bank",
  "examDraft": null,
  "items": [
    {
      "sourceRef": {
        "fileName": "Screenshot (1091).png",
        "pageIndex": 1,
        "region": null
      },
      "sourceOrder": 1,
      "originalNumber": 102,
      "stemBlocks": [
        {
          "type": "markdown",
          "text": "What is the use of the ESP8266 WiFi Module?"
        }
      ],
      "options": [
        {
          "sourceLabel": "A",
          "blocks": [
            {
              "type": "markdown",
              "text": "Network Provider"
            }
          ]
        },
        {
          "sourceLabel": "B",
          "blocks": [
            {
              "type": "markdown",
              "text": "Switches circuits"
            }
          ]
        },
        {
          "sourceLabel": "C",
          "blocks": [
            {
              "type": "markdown",
              "text": "Evaluates air pressure"
            }
          ]
        },
        {
          "sourceLabel": "D",
          "blocks": [
            {
              "type": "markdown",
              "text": "Monitors Motion"
            }
          ]
        }
      ],
      "answer": {
        "sourceLabels": [
          "A"
        ],
        "evidence": "explicit",
        "evidenceText": "Answer label A is shown in the presenter notes panel."
      },
      "maxSelections": 1,
      "explanation": null,
      "topicIds": [],
      "extractionConfidence": 0.98,
      "needsReview": false,
      "issues": []
    },
    {
      "sourceRef": {
        "fileName": "Screenshot (1092).png",
        "pageIndex": 1,
        "region": null
      },
      "sourceOrder": 2,
      "originalNumber": 103,
      "stemBlocks": [
        {
          "type": "markdown",
          "text": "What is the term for the extension of the existing Internet structure to billions of connected devices?"
        }
      ],
      "options": [
        {
          "sourceLabel": "A",
          "blocks": [
            {
              "type": "markdown",
              "text": "Digitization"
            }
          ]
        },
        {
          "sourceLabel": "B",
          "blocks": [
            {
              "type": "markdown",
              "text": "M2M"
            }
          ]
        },
        {
          "sourceLabel": "C",
          "blocks": [
            {
              "type": "markdown",
              "text": "IoT"
            }
          ]
        },
        {
          "sourceLabel": "D",
          "blocks": [
            {
              "type": "markdown",
              "text": "B2B"
            }
          ]
        }
      ],
      "answer": {
        "sourceLabels": [
          "C"
        ],
        "evidence": "explicit",
        "evidenceText": "Answer label C is shown in the presenter notes panel."
      },
      "maxSelections": 1,
      "explanation": null,
      "topicIds": [],
      "extractionConfidence": 0.98,
      "needsReview": false,
      "issues": []
    },
    {
      "sourceRef": {
        "fileName": "Screenshot (1093).png",
        "pageIndex": 1,
        "region": null
      },
      "sourceOrder": 3,
      "originalNumber": 104,
      "stemBlocks": [
        {
          "type": "markdown",
          "text": "What does NFC stand for?"
        }
      ],
      "options": [
        {
          "sourceLabel": "A",
          "blocks": [
            {
              "type": "markdown",
              "text": "Near Fast Connection"
            }
          ]
        },
        {
          "sourceLabel": "B",
          "blocks": [
            {
              "type": "markdown",
              "text": "Near Field Connection"
            }
          ]
        },
        {
          "sourceLabel": "C",
          "blocks": [
            {
              "type": "markdown",
              "text": "Near Fast Communication"
            }
          ]
        },
        {
          "sourceLabel": "D",
          "blocks": [
            {
              "type": "markdown",
              "text": "Near Field Communication"
            }
          ]
        }
      ],
      "answer": {
        "sourceLabels": [
          "D"
        ],
        "evidence": "explicit",
        "evidenceText": "Answer label D is shown in the presenter notes panel."
      },
      "maxSelections": 1,
      "explanation": null,
      "topicIds": [],
      "extractionConfidence": 0.98,
      "needsReview": false,
      "issues": []
    },
    {
      "sourceRef": {
        "fileName": "Screenshot (1094).png",
        "pageIndex": 1,
        "region": null
      },
      "sourceOrder": 4,
      "originalNumber": 105,
      "stemBlocks": [
        {
          "type": "markdown",
          "text": "What does a fog extend cloud to?"
        }
      ],
      "options": [
        {
          "sourceLabel": "A",
          "blocks": [
            {
              "type": "markdown",
              "text": "Application to process logic"
            }
          ]
        },
        {
          "sourceLabel": "B",
          "blocks": [
            {
              "type": "markdown",
              "text": "Storage of processed data"
            }
          ]
        },
        {
          "sourceLabel": "C",
          "blocks": [
            {
              "type": "markdown",
              "text": "Things that process and act on data"
            }
          ]
        },
        {
          "sourceLabel": "D",
          "blocks": [
            {
              "type": "markdown",
              "text": "Hardware for executing boot loading"
            }
          ]
        }
      ],
      "answer": {
        "sourceLabels": [
          "C"
        ],
        "evidence": "explicit",
        "evidenceText": "Answer label C is shown in the presenter notes panel."
      },
      "maxSelections": 1,
      "explanation": null,
      "topicIds": [],
      "extractionConfidence": 0.98,
      "needsReview": false,
      "issues": []
    },
    {
      "sourceRef": {
        "fileName": "Screenshot (1095).png",
        "pageIndex": 1,
        "region": null
      },
      "sourceOrder": 5,
      "originalNumber": 106,
      "stemBlocks": [
        {
          "type": "markdown",
          "text": "What additional consideration is necessary to make an IoT project successful compared to existing solutions?"
        }
      ],
      "options": [
        {
          "sourceLabel": "A",
          "blocks": [
            {
              "type": "markdown",
              "text": "Focus on expensive materials"
            }
          ]
        },
        {
          "sourceLabel": "B",
          "blocks": [
            {
              "type": "markdown",
              "text": "Implement the latest IoT protocols"
            }
          ]
        },
        {
          "sourceLabel": "C",
          "blocks": [
            {
              "type": "markdown",
              "text": "Be better than current solutions"
            }
          ]
        },
        {
          "sourceLabel": "D",
          "blocks": [
            {
              "type": "markdown",
              "text": "Use cutting-edge programming languages"
            }
          ]
        }
      ],
      "answer": {
        "sourceLabels": [
          "C"
        ],
        "evidence": "explicit",
        "evidenceText": "Answer label C is shown in the presenter notes panel."
      },
      "maxSelections": 1,
      "explanation": null,
      "topicIds": [],
      "extractionConfidence": 0.98,
      "needsReview": false,
      "issues": []
    },
    {
      "sourceRef": {
        "fileName": "Screenshot (1096).png",
        "pageIndex": 1,
        "region": null
      },
      "sourceOrder": 6,
      "originalNumber": 107,
      "stemBlocks": [
        {
          "type": "markdown",
          "text": "What pin mode is used for the button in the Arduino setup code?"
        }
      ],
      "options": [
        {
          "sourceLabel": "A",
          "blocks": [
            {
              "type": "markdown",
              "text": "OUTPUT"
            }
          ]
        },
        {
          "sourceLabel": "B",
          "blocks": [
            {
              "type": "markdown",
              "text": "INPUT"
            }
          ]
        },
        {
          "sourceLabel": "C",
          "blocks": [
            {
              "type": "markdown",
              "text": "ANALOG"
            }
          ]
        },
        {
          "sourceLabel": "D",
          "blocks": [
            {
              "type": "markdown",
              "text": "PWM"
            }
          ]
        }
      ],
      "answer": {
        "sourceLabels": [
          "B"
        ],
        "evidence": "explicit",
        "evidenceText": "Answer label B is shown in the presenter notes panel."
      },
      "maxSelections": 1,
      "explanation": null,
      "topicIds": [],
      "extractionConfidence": 0.98,
      "needsReview": false,
      "issues": []
    },
    {
      "sourceRef": {
        "fileName": "Screenshot (1097).png",
        "pageIndex": 1,
        "region": null
      },
      "sourceOrder": 7,
      "originalNumber": 108,
      "stemBlocks": [
        {
          "type": "markdown",
          "text": "What type of loop is used to repeatedly check a sensor?"
        }
      ],
      "options": [
        {
          "sourceLabel": "A",
          "blocks": [
            {
              "type": "markdown",
              "text": "FOR loop"
            }
          ]
        },
        {
          "sourceLabel": "B",
          "blocks": [
            {
              "type": "markdown",
              "text": "LOOP function"
            }
          ]
        },
        {
          "sourceLabel": "C",
          "blocks": [
            {
              "type": "markdown",
              "text": "setup() function"
            }
          ]
        },